{
  "schemaVersion": 1,
  "sessionId": "ASES-0004",
  "specId": "SPEC-0002",
  "role": "IMPLEMENTER",
  "actorType": "ai",
  "actorId": "b3-ci-remediation",
  "taskIds": [
    "TASK-013"
  ],
  "startedFromCommit": "f16ed677516fb07f31832a5d725e13efb477c34d",
  "initialChangedPaths": [
    ".github/workflows/sdd-validate.yml",
    "AGENTS.md",
    "CLAUDE.md",
    "apps/web/src/app/(auth)/login/LoginForm.tsx",
    "apps/web/src/app/(auth)/login/page.tsx",
    "apps/web/src/app/(workspace)/[workspaceSlug]/ai/",
    "apps/web/src/app/(workspace)/[workspaceSlug]/dashboard/page.tsx",
    "apps/web/src/app/(workspace)/[workspaceSlug]/layout.tsx",
    "apps/web/src/app/(workspace)/[workspaceSlug]/sales/leads/LeadGrid.tsx",
    "apps/web/src/app/(workspace)/[workspaceSlug]/sales/leads/LeadImport.tsx",
    "apps/web/src/app/(workspace)/[workspaceSlug]/sales/leads/[id]/LeadDetail.tsx",
    "apps/web/src/app/(workspace)/[workspaceSlug]/sales/leads/[id]/page.tsx",
    "apps/web/src/app/(workspace)/[workspaceSlug]/sales/leads/page.tsx",
    "apps/web/src/app/globals.css",
    "apps/web/src/app/icon.svg",
    "apps/web/src/app/layout.tsx",
    "apps/web/src/app/manifest.ts",
    "apps/web/src/components/assistant/AssistantWidget.tsx",
    "apps/web/src/components/auth/AuthShell.tsx",
    "apps/web/src/components/brand/YouhanMark.tsx",
    "apps/web/src/components/nav/CommandPalette.tsx",
    "apps/web/src/components/nav/TopBar.tsx",
    "apps/web/src/components/platform/SupportModeBanner.tsx",
    "apps/web/src/components/ui/AiInsight.tsx",
    "apps/web/src/components/ui/Badge.tsx",
    "apps/web/src/components/ui/EmptyState.tsx",
    "apps/web/src/components/ui/MetricCard.tsx",
    "apps/web/src/components/ui/PageHeader.tsx",
    "apps/web/src/components/ui/StageRail.tsx",
    "apps/web/src/components/workspace/ColumnEditor.tsx",
    "apps/web/src/components/workspace/ConfigurableGrid.tsx",
    "apps/web/src/components/workspace/ListHeader.tsx",
    "apps/web/src/components/workspace/MobileTabBar.tsx",
    "apps/web/src/components/workspace/Pager.tsx",
    "apps/web/src/components/workspace/WorkspaceSidebar.tsx",
    "apps/web/src/components/workspace/WorkspaceTopBar.tsx",
    "apps/web/src/lib/nav/modKey.ts",
    "apps/web/src/lib/nav/workspaceNav.ts",
    "apps/web/src/styles/tokens.css",
    "docs/EVIDENCE_CONFLICTS.md",
    "docs/PHASE_A_GAP_ANALYSIS.md",
    "docs/RISK_CLASSIFICATION.md",
    "docs/SYSTEM_INVENTORY.md",
    "docs/architecture/",
    "docs/evidence/phase-a-foundation/",
    "docs/evidence/phase-b1-sdd-foundation/",
    "docs/evidence/phase-b2-sdd-verification-enforcement/",
    "docs/evidence/phase-b3-agent-integration/",
    "docs/operations/",
    "docs/sdd/",
    "docs/security/",
    "docs/standards/",
    "sdd.config.json",
    "specs/",
    "tools/"
  ],
  "initialDigests": {
    ".github/workflows/sdd-validate.yml": "18c685c485f3c0f9920bf7dd7008c9d9808fa9fc0b024100c412074a36bd4891",
    "AGENTS.md": "f0c00e8cb62a12394abae2be59699422d943eac3649b7c207b181ee01ca86c2a",
    "CLAUDE.md": "4c7d49d9bf65ba99717d88fe31eea1bf99ffe46df28c9bc0cf199f493a5e9668",
    "apps/web/src/app/(auth)/login/LoginForm.tsx": "aa4bd3d7be099e4aca208ab11c344d0956f626463f2b7216d5290b3790576d01",
    "apps/web/src/app/(auth)/login/page.tsx": "10bf0f2beade19b38ac9f0027aa6d0a3f9bede24b4a2235f4a651a7896c73c49",
    "apps/web/src/app/(workspace)/[workspaceSlug]/ai/": "<directory>",
    "apps/web/src/app/(workspace)/[workspaceSlug]/dashboard/page.tsx": "e7572cab173d0bf87f15067d779a4b072acd0f4e4a1a69a776b2b489e94b8b55",
    "apps/web/src/app/(workspace)/[workspaceSlug]/layout.tsx": "1e46f713e63bd3cab9fbcdb410b31122b5e300ca4a629ec543cbd83052bc1d36",
    "apps/web/src/app/(workspace)/[workspaceSlug]/sales/leads/LeadGrid.tsx": "9b760c3921f433e3e886651ff87c752c042b1ab993654254119705c2df0363e1",
    "apps/web/src/app/(workspace)/[workspaceSlug]/sales/leads/LeadImport.tsx": "1cc860eae11a5b640ab394095ee288c7b21cec24f62793581dfd081de3738891",
    "apps/web/src/app/(workspace)/[workspaceSlug]/sales/leads/[id]/LeadDetail.tsx": "844648575c652096596d25120f326789bc41ab809986d23933d3e0f1e3c84a76",
    "apps/web/src/app/(workspace)/[workspaceSlug]/sales/leads/[id]/page.tsx": "bdda62f94728aa11680d963950eb6e286248bdfcf9ddf574aa3ff39128d71726",
    "apps/web/src/app/(workspace)/[workspaceSlug]/sales/leads/page.tsx": "bf47e58192d717e652738cbd97505f77b73955e37a7a133450f0c6dc58ea44eb",
    "apps/web/src/app/globals.css": "32980b274319114511c09f9fde7a1a9b2175b68b21e0c5217922c09c51f2868e",
    "apps/web/src/app/icon.svg": "b0376a9a61186c58aaa04a29eca0a041cc874892af245907b7daee75e5069403",
    "apps/web/src/app/layout.tsx": "65a0e7315beec9a89c9eb7a5d1bf7479d9c7f9ce041661657f63961927b22ef4",
    "apps/web/src/app/manifest.ts": "9287de684ae33632d2f3f09d0e5352863fac701202eadfbfc30249c34df88ea6",
    "apps/web/src/components/assistant/AssistantWidget.tsx": "3aead0ecf525fddbd25be77d4c830a8271f1507a785dc623bd932577bac98317",
    "apps/web/src/components/auth/AuthShell.tsx": "9a387b1b3524cf5360bc71e49bda277b0efa24952545f8e593f9f88b4e30c9d5",
    "apps/web/src/components/brand/YouhanMark.tsx": "27a4ec152235360ab732caa83e3e2be73a63a193ab2b04162b465e9af04af0d5",
    "apps/web/src/components/nav/CommandPalette.tsx": "98c77ff3d35f54b1abf66f40c5342e4d560454e205b7fc9aa749f87761b3cd82",
    "apps/web/src/components/nav/TopBar.tsx": "eddeb361dfdc8ce06e0130c4244d2703821b314a10ef6bc0ba77854d25f7fe4a",
    "apps/web/src/components/platform/SupportModeBanner.tsx": "ab82606900b1a7dec31835d33db4663170de53673d4c32d31cf2ab9891fbc336",
    "apps/web/src/components/ui/AiInsight.tsx": "606ef2c3ff8a13f2013d8490645b74a4a03b85db4edab583da3baa24a6073421",
    "apps/web/src/components/ui/Badge.tsx": "49897327d1a1f9c9740c5c13acd224fa2323772ad91cdc641225c1b0a61fb9cc",
    "apps/web/src/components/ui/EmptyState.tsx": "631e3a198768682c6e190e1647582733f1029bd59b8fd5200fbf32b9d5ec7831",
    "apps/web/src/components/ui/MetricCard.tsx": "14ef20cc6b367ae0cfc7789e3251c88794615a90b182c1dd9fe3efe498e32c5d",
    "apps/web/src/components/ui/PageHeader.tsx": "0aa208e58aad9b40fa1768020d639190aaaaaf0f5c0aded9618ad80b27a1faf7",
    "apps/web/src/components/ui/StageRail.tsx": "b0ebf3865ecb2b98c7a088e76543e104a47c1902d3268eb6a3b19be7e4e9308a",
    "apps/web/src/components/workspace/ColumnEditor.tsx": "f1c548da4fc0b794d2d7ec0871e61f102786c7b04e4173d8b32e3b85b0ed1984",
    "apps/web/src/components/workspace/ConfigurableGrid.tsx": "d3fdea7b9c2b1b6d3cd5a390854362d5f97958f1aedb998cb779ed7a968f1978",
    "apps/web/src/components/workspace/ListHeader.tsx": "5b0100c0b5875be75e6738bbeea04c2c0c4a0962493b6f756078eb42c9595bd0",
    "apps/web/src/components/workspace/MobileTabBar.tsx": "0f9a3dc047a0aa9d49da9c8bcecdc3b868f70682db4726090a75ff0204b25e5a",
    "apps/web/src/components/workspace/Pager.tsx": "725027c01865daed76f1161faa8ce07a390dbcbf328fdb69a603979051a9c59e",
    "apps/web/src/components/workspace/WorkspaceSidebar.tsx": "eefeaf879aeecd54f4bbd7fbe720c69e411813227f0fd759c48d8ea8fc37fdb0",
    "apps/web/src/components/workspace/WorkspaceTopBar.tsx": "d79f0f434042d0c17a8828ae5a317667533bf0697f945ff1971050904d93e593",
    "apps/web/src/lib/nav/modKey.ts": "11d56912f2b4af47d33a8be79cc6fcdeda5dceb14cb6a6fc348b7bbd81fbe92d",
    "apps/web/src/lib/nav/workspaceNav.ts": "adfdebce1c666bb73ed0ad7e445919dd5236531c89e19b6ec86e48b1307a7190",
    "apps/web/src/styles/tokens.css": "49b3e9f3b40c5c6ce8d952eb4311cd5323fbf22579e5ec8885ec9a004e2e97a7",
    "docs/EVIDENCE_CONFLICTS.md": "c766a6947720d8a01b726bda04932696214e2d1b60e91ef076e379786941283c",
    "docs/PHASE_A_GAP_ANALYSIS.md": "18140d5c94f5eaaed9f26df8c2ee7ebe011caa4928f5276e0d2ce18574ccecc1",
    "docs/RISK_CLASSIFICATION.md": "ea3bfdc939c089e0a526983be2e97c00fb8863c90f9aedb83a36f048afeba070",
    "docs/SYSTEM_INVENTORY.md": "fe327f71e8e6d8627faa7338552da7edf2b777d36a26be3fb845f9945cc7bd58",
    "docs/architecture/": "<directory>",
    "docs/evidence/phase-a-foundation/": "<directory>",
    "docs/evidence/phase-b1-sdd-foundation/": "<directory>",
    "docs/evidence/phase-b2-sdd-verification-enforcement/": "<directory>",
    "docs/evidence/phase-b3-agent-integration/": "<directory>",
    "docs/operations/": "<directory>",
    "docs/sdd/": "<directory>",
    "docs/security/": "<directory>",
    "docs/standards/": "<directory>",
    "sdd.config.json": "e831da3e6f1e47db8dc0319d407163e5870633b7ed34000590d6983538e857f6",
    "specs/": "<directory>",
    "tools/": "<directory>"
  },
  "allowedPaths": [
    ".github/workflows/sdd-validate.yml"
  ],
  "prohibitedPaths": [
    "apps/",
    "tools/sdd/",
    "prisma/"
  ],
  "requiredTests": [
    "IT-008"
  ],
  "requiredApprovals": [],
  "status": "COMPLETE",
  "result": "PARTIAL",
  "verifiedTests": [
    "IT-008"
  ],
  "notes": [
    "Remediates CONV-005 under CHG-004, authorised by decision D6 (DevOps / Production Engineering).",
    "First session created with initialDigests (55 entries), so attribution is fully decidable here: 41 pre-existing paths correctly not blamed, 12 directory entries reported as unattributable for review.",
    "Scope deviation, recorded not waived: docs/EVIDENCE_CONFLICTS.md changed while this session was open, from concurrent D2 governance work. Outside TASK-013 scope; reported as SDD-V046. TASK-013 scope was NOT widened. Correct sequencing would have finished the D2 corrections before opening this session.",
    "Unexpected findings: none in the workflow change itself.",
    "New unknowns: whether the workflow passes on a GitHub-hosted Linux runner. It has never executed there.",
    "Result corrected from PASS to PARTIAL by the scope-deviation audit (2026-09-08). The TASK-013 deliverable was completed, verified and independently reviewed; the session nonetheless produced an out-of-scope change and did not pass cleanly. TASK-013 was not widened and no retroactive session was created."
  ]
}
