{
  "schemaVersion": 1,
  "sessionId": "ASES-0001",
  "specId": "SPEC-0002",
  "role": "IMPLEMENTER",
  "actorType": "ai",
  "actorId": "b3-implementer-session",
  "taskIds": [
    "TASK-010"
  ],
  "startedFromCommit": "f16ed677516fb07f31832a5d725e13efb477c34d",
  "initialChangedPaths": [
    ".github/workflows/sdd-validate.yml",
    "AGENTS.md",
    "CLAUDE.md",
    "apps/web/src/app/(auth)/login/LoginForm.tsx",
    "apps/web/src/app/(auth)/login/page.tsx",
    "apps/web/src/app/(workspace)/[workspaceSlug]/ai/",
    "apps/web/src/app/(workspace)/[workspaceSlug]/dashboard/page.tsx",
    "apps/web/src/app/(workspace)/[workspaceSlug]/layout.tsx",
    "apps/web/src/app/(workspace)/[workspaceSlug]/sales/leads/LeadGrid.tsx",
    "apps/web/src/app/(workspace)/[workspaceSlug]/sales/leads/LeadImport.tsx",
    "apps/web/src/app/(workspace)/[workspaceSlug]/sales/leads/[id]/LeadDetail.tsx",
    "apps/web/src/app/(workspace)/[workspaceSlug]/sales/leads/[id]/page.tsx",
    "apps/web/src/app/(workspace)/[workspaceSlug]/sales/leads/page.tsx",
    "apps/web/src/app/globals.css",
    "apps/web/src/app/icon.svg",
    "apps/web/src/app/layout.tsx",
    "apps/web/src/app/manifest.ts",
    "apps/web/src/components/assistant/AssistantWidget.tsx",
    "apps/web/src/components/auth/AuthShell.tsx",
    "apps/web/src/components/brand/YouhanMark.tsx",
    "apps/web/src/components/nav/CommandPalette.tsx",
    "apps/web/src/components/nav/TopBar.tsx",
    "apps/web/src/components/platform/SupportModeBanner.tsx",
    "apps/web/src/components/ui/AiInsight.tsx",
    "apps/web/src/components/ui/Badge.tsx",
    "apps/web/src/components/ui/EmptyState.tsx",
    "apps/web/src/components/ui/MetricCard.tsx",
    "apps/web/src/components/ui/PageHeader.tsx",
    "apps/web/src/components/ui/StageRail.tsx",
    "apps/web/src/components/workspace/ColumnEditor.tsx",
    "apps/web/src/components/workspace/ConfigurableGrid.tsx",
    "apps/web/src/components/workspace/ListHeader.tsx",
    "apps/web/src/components/workspace/MobileTabBar.tsx",
    "apps/web/src/components/workspace/Pager.tsx",
    "apps/web/src/components/workspace/WorkspaceSidebar.tsx",
    "apps/web/src/components/workspace/WorkspaceTopBar.tsx",
    "apps/web/src/lib/nav/modKey.ts",
    "apps/web/src/lib/nav/workspaceNav.ts",
    "apps/web/src/styles/tokens.css",
    "docs/EVIDENCE_CONFLICTS.md",
    "docs/PHASE_A_GAP_ANALYSIS.md",
    "docs/RISK_CLASSIFICATION.md",
    "docs/SYSTEM_INVENTORY.md",
    "docs/architecture/",
    "docs/evidence/phase-a-foundation/",
    "docs/evidence/phase-b1-sdd-foundation/",
    "docs/evidence/phase-b2-sdd-verification-enforcement/",
    "docs/evidence/phase-b3-agent-integration/",
    "docs/operations/",
    "docs/sdd/",
    "docs/security/",
    "docs/standards/",
    "sdd.config.json",
    "specs/",
    "tools/"
  ],
  "allowedPaths": [
    "specs/SPEC-0002-agent-integration-controlled-execution/execution/",
    "docs/evidence/phase-b3-agent-integration/"
  ],
  "prohibitedPaths": [],
  "requiredTests": [
    "REG-001"
  ],
  "requiredApprovals": [],
  "status": "COMPLETE",
  "result": "PARTIAL",
  "verifiedTests": [
    "REG-001"
  ],
  "notes": [
    "Governs the tail of TASK-010 only. TASK-001 to TASK-009 and the earlier part of TASK-010 predate this control plane; see CONV-003.",
    "Unexpected findings: ST-002 in the SPEC-0001 suite now fails (CONV-006); scope-check attributes pre-existing dirty files to the session (CONV-007).",
    "Scope deviations: none. Both fixes were declined because they fall outside the declared scope.",
    "New unknowns: whether the CI workflow passes on a Linux runner; whether the control plane helps or obstructs on a real product change."
  ]
}
